{
  "schema_version": "1.0.0",
  "document_type": "ingest-plan-result",
  "document_id": "fixture-dryrun_001",
  "created_at": "2026-01-01T00:00:00Z",
  "workspace": "workspace_demo",
  "source_id": "src_synthetic_01",
  "source_hash": {
    "algorithm": "sha256",
    "value": "1111111111111111111111111111111111111111111111111111111111111111"
  },
  "review_generation": 1,
  "producer": {
    "kind": "ENGINE",
    "name": "s9k-data-engine",
    "version": "0.0.0-test",
    "model": null
  },
  "provenance": {
    "source_id": "src_synthetic_01",
    "source_hash": {
      "algorithm": "sha256",
      "value": "1111111111111111111111111111111111111111111111111111111111111111"
    },
    "review_generation": 1,
    "pipeline_version": "0.0.0-test",
    "producer": {
      "kind": "ENGINE",
      "name": "s9k-data-engine",
      "version": "0.0.0-test",
      "model": null
    }
  },
  "execution_id": "exec_synth_001",
  "plan_id": "plan_synth_001",
  "mode": "DRY_RUN",
  "started_at": "2026-01-01T00:10:00Z",
  "finished_at": "2026-01-01T00:10:01Z",
  "status": "SUCCEEDED",
  "operations": [
    {
      "operation_id": "op_001",
      "result": "WOULD_CREATE",
      "target_entity_id": null,
      "detail": "nuevo"
    }
  ],
  "summary": {
    "would_create": 1,
    "created": 0,
    "skipped": 0,
    "conflict": 0,
    "failed": 0,
    "rolled_back": 0
  },
  "neo4j_before": {
    "nodes": 0,
    "relationships": 0
  },
  "neo4j_after": {
    "nodes": 0,
    "relationships": 0
  },
  "errors": [],
  "warnings": []
}
